question,answer,instruction
Who directed Trigger Warning?,'Trigger Warning' was directed by Mouly Surya.,Answer the following question:
What are the genres of Trigger Warning?,"The genres of 'Trigger Warning' are Action, Crime, Thriller.",Answer the following question:
Who is the lead actor in Trigger Warning?,The lead actor in 'Trigger Warning' is Jessica Alba.,Answer the following question:
When was Trigger Warning released?,"'Trigger Warning' was released on June 20, 2024.",Answer the following question:
Who are the supporting actors in Trigger Warning?,"The supporting actors in 'Trigger Warning' are Anthony Michael Hall, Tone Bell, Mark Webber, Jake Weary, Gabriel Basso, Kaiwi Lyman, Hari Dhillon, Alejandro De Hoyos, Nadiv Molcho.",Answer the following question:
What is the rating of Trigger Warning?,The rating of 'Trigger Warning' is 5.837.,Answer the following question:
What is the movie Trigger Warning about?,"The film titled 'Trigger Warning' was released on June 20, 2024. It falls under the genres of Action, Crime, Thriller. The film was directed by Mouly Surya and stars Jessica Alba, Anthony Michael Hall, Tone Bell, Mark Webber, Jake Weary, Gabriel Basso, Kaiwi Lyman, Hari Dhillon, Alejandro De Hoyos, Nadiv Molcho. The lead actor is Jessica Alba. Plot summary: A Special Forces commando uncovers a dangerous conspiracy when she returns to her hometown looking for answers into her beloved father's death.. It has received a rating of 5.837.",Answer the following question:
What is the plot of Kung Fu Panda 4?,"The plot of 'Kung Fu Panda 4' is about Po is gearing up to become the spiritual leader of his Valley of Peace, but also needs someone to take his place as Dragon Warrior. As such, he will train a new kung fu practitioner for the spot and will encounter a villain called the Chameleon who conjures villains from the past..",Answer the following question:
Who are in the cast of Kung Fu Panda 4?,"The cast of 'Kung Fu Panda 4' includes Jack Black, Awkwafina, Viola Davis, Dustin Hoffman, Bryan Cranston, James Hong, Ian McShane, Ke Huy Quan, Ronny Chieng, Lori Tan Chinn.",Answer the following question:
Who directed Kung Fu Panda 4?,'Kung Fu Panda 4' was directed by Mike Mitchell.,Answer the following question:
What are the genres of Kung Fu Panda 4?,"The genres of 'Kung Fu Panda 4' are Animation, Family, Fantasy.",Answer the following question:
Who is the lead actor in Kung Fu Panda 4?,The lead actor in 'Kung Fu Panda 4' is Jack Black.,Answer the following question:
When was Kung Fu Panda 4 released?,"'Kung Fu Panda 4' was released on March 02, 2024.",Answer the following question:
Who are the supporting actors in Kung Fu Panda 4?,"The supporting actors in 'Kung Fu Panda 4' are Awkwafina, Viola Davis, Dustin Hoffman, Bryan Cranston, James Hong, Ian McShane, Ke Huy Quan, Ronny Chieng, Lori Tan Chinn.",Answer the following question:
What is the rating of Kung Fu Panda 4?,The rating of 'Kung Fu Panda 4' is 7.14.,Answer the following question:
What is the movie Kung Fu Panda 4 about?,"The film titled 'Kung Fu Panda 4' was released on March 02, 2024. It falls under the genres of Animation, Family, Fantasy. The film was directed by Mike Mitchell and stars Jack Black, Awkwafina, Viola Davis, Dustin Hoffman, Bryan Cranston, James Hong, Ian McShane, Ke Huy Quan, Ronny Chieng, Lori Tan Chinn. The lead actor is Jack Black. Plot summary: Po is gearing up to become the spiritual leader of his Valley of Peace, but also needs someone to take his place as Dragon Warrior. As such, he will train a new kung fu practitioner for the spot and will encounter a villain called the Chameleon who conjures villains from the past.. It has received a rating of 7.14.",Answer the following question:
What is the plot of In a Violent Nature?,"The plot of 'In a Violent Nature' is about The enigmatic resurrection, rampage, and retribution of an undead monster in a remote wilderness unleashes an iconic new killer after a locket is removed from a collapsed fire tower that entombed its rotting corpse..",Answer the following question:
Who are in the cast of In a Violent Nature?,"The cast of 'In a Violent Nature' includes Ry Barrett, Andrea Pavlovic, Cameron Love, Reece Presley, Liam Leone, Charlotte Creaghan, Lea Rose Sebastianis, Sam Roulston, Alexander Oliver, Timothy Paul McCarthy.",Answer the following question:
Who directed In a Violent Nature?,'In a Violent Nature' was directed by Chris Nash.,Answer the following question:
What are the genres of In a Violent Nature?,"The genres of 'In a Violent Nature' are Horror, Thriller.",Answer the following question:
Who is the lead actor in In a Violent Nature?,The lead actor in 'In a Violent Nature' is Ry Barrett.,Answer the following question:
When was In a Violent Nature released?,"'In a Violent Nature' was released on May 31, 2024.",Answer the following question:
Who are the supporting actors in In a Violent Nature?,"The supporting actors in 'In a Violent Nature' are Andrea Pavlovic, Cameron Love, Reece Presley, Liam Leone, Charlotte Creaghan, Lea Rose Sebastianis, Sam Roulston, Alexander Oliver, Timothy Paul McCarthy.",Answer the following question:
What is the rating of In a Violent Nature?,The rating of 'In a Violent Nature' is 5.8.,Answer the following question:
What is the movie In a Violent Nature about?,"The film titled 'In a Violent Nature' was released on May 31, 2024. It falls under the genres of Horror, Thriller. The film was directed by Chris Nash and stars Ry Barrett, Andrea Pavlovic, Cameron Love, Reece Presley, Liam Leone, Charlotte Creaghan, Lea Rose Sebastianis, Sam Roulston, Alexander Oliver, Timothy Paul McCarthy. The lead actor is Ry Barrett. Plot summary: The enigmatic resurrection, rampage, and retribution of an undead monster in a remote wilderness unleashes an iconic new killer after a locket is removed from a collapsed fire tower that entombed its rotting corpse.. It has received a rating of 5.8.",Answer the following question:
What is the plot of The Infallibles?,"The plot of 'The Infallibles' is about When a gang of robbers provokes chaos in Paris and humiliates the police, the Minister of the Interior wants new blood at the helm of the investigation: Alia is from Marseille, fiery-tempered and unmanageable, Hugo is Parisian, valedictorian and meticulous. In short, they have every reason to hate each other. A forced alliance, for better or for worse, or maybe blossoming into something else?.",Answer the following question:
Who are in the cast of The Infallibles?,"The cast of 'The Infallibles' includes Ines Reg, Kevin Debonne, Vincent Rottiers, Moussa Maaskri, Francois Neycken, Pierre Olivier, Hugo Gonzalez, Daphne Huynh, Loriane Klupsch, Adele Sierra.",Answer the following question:
Who directed The Infallibles?,'The Infallibles' was directed by Frederic Forestier.,Answer the following question:
What are the genres of The Infallibles?,"The genres of 'The Infallibles' are Comedy, Action.",Answer the following question:
Who is the lead actor in The Infallibles?,The lead actor in 'The Infallibles' is Ines Reg.,Answer the following question:
When was The Infallibles released?,"'The Infallibles' was released on June 20, 2024.",Answer the following question:
Who are the supporting actors in The Infallibles?,"The supporting actors in 'The Infallibles' are Kevin Debonne, Vincent Rottiers, Moussa Maaskri, Francois Neycken, Pierre Olivier, Hugo Gonzalez, Daphne Huynh, Loriane Klupsch, Adele Sierra.",Answer the following question:
What is the rating of The Infallibles?,The rating of 'The Infallibles' is 5.844.,Answer the following question:
What is the movie The Infallibles about?,"The film titled 'The Infallibles' was released on June 20, 2024. It falls under the genres of Comedy, Action. The film was directed by Frederic Forestier and stars Ines Reg, Kevin Debonne, Vincent Rottiers, Moussa Maaskri, Francois Neycken, Pierre Olivier, Hugo Gonzalez, Daphne Huynh, Loriane Klupsch, Adele Sierra. The lead actor is Ines Reg. Plot summary: When a gang of robbers provokes chaos in Paris and humiliates the police, the Minister of the Interior wants new blood at the helm of the investigation: Alia is from Marseille, fiery-tempered and unmanageable, Hugo is Parisian, valedictorian and meticulous. In short, they have every reason to hate each other. A forced alliance, for better or for worse, or maybe blossoming into something else?. It has received a rating of 5.844.",Answer the following question:
What is the plot of MR-9: Do or Die?,The plot of 'MR-9: Do or Die' is about Masud Rana is a Secret Agent with code name MR-9 of the Bangladesh Counter Intelligence Agency.,Answer the following question:
Who are in the cast of MR-9: Do or Die?,"The cast of 'MR-9: Do or Die' includes Frank Grillo, Michael Jai White, Kelly Greyson, Matt Passmore, Sakshi Pradhan, Omi Vaidya, James Moses Black, Dave Kumar, ABM Sumon, Oleg Prudius.",Answer the following question:
Who directed MR-9: Do or Die?,'MR-9: Do or Die' was directed by Asif Akbar.,Answer the following question:
What are the genres of MR-9: Do or Die?,"The genres of 'MR-9: Do or Die' are Action, Drama, Thriller.",Answer the following question:
Who is the lead actor in MR-9: Do or Die?,The lead actor in 'MR-9: Do or Die' is Frank Grillo.,Answer the following question:
When was MR-9: Do or Die released?,"'MR-9: Do or Die' was released on August 25, 2023.",Answer the following question:
Who are the supporting actors in MR-9: Do or Die?,"The supporting actors in 'MR-9: Do or Die' are Michael Jai White, Kelly Greyson, Matt Passmore, Sakshi Pradhan, Omi Vaidya, James Moses Black, Dave Kumar, ABM Sumon, Oleg Prudius.",Answer the following question:
What is the rating of MR-9: Do or Die?,The rating of 'MR-9: Do or Die' is 6.437.,Answer the following question:
What is the movie MR-9: Do or Die about?,"The film titled 'MR-9: Do or Die' was released on August 25, 2023. It falls under the genres of Action, Drama, Thriller. The film was directed by Asif Akbar and stars Frank Grillo, Michael Jai White, Kelly Greyson, Matt Passmore, Sakshi Pradhan, Omi Vaidya, James Moses Black, Dave Kumar, ABM Sumon, Oleg Prudius. The lead actor is Frank Grillo. Plot summary: Masud Rana is a Secret Agent with code name MR-9 of the Bangladesh Counter Intelligence Agency. It has received a rating of 6.437.",Answer the following question:
What is the plot of Horizon: An American Saga - Chapter 1?,"The plot of 'Horizon: An American Saga - Chapter 1' is about Follow the story of how the Old West was won--and lost--through the blood, sweat and tears of many. Spanning 15 years before, during and following the Civil War from 1859 to 1874, embark on an emotional journey across a country at war with itself, experienced through the lens of families, friends and foes all attempting to discover what it truly means to be the United States of America..",Answer the following question:
Who are in the cast of Horizon: An American Saga - Chapter 1?,"The cast of 'Horizon: An American Saga - Chapter 1' includes Kevin Costner, Sienna Miller, Sam Worthington, Jena Malone, Abbey Lee, Michael Rooker, Danny Huston, Luke Wilson, Ella Hunt, Tatanka Means.",Answer the following question:
Who directed Horizon: An American Saga - Chapter 1?,'Horizon: An American Saga - Chapter 1' was directed by Kevin Costner.,Answer the following question:
What are the genres of Horizon: An American Saga - Chapter 1?,"The genres of 'Horizon: An American Saga - Chapter 1' are Western, Drama.",Answer the following question:
Who is the lead actor in Horizon: An American Saga - Chapter 1?,The lead actor in 'Horizon: An American Saga - Chapter 1' is Kevin Costner.,Answer the following question:
When was Horizon: An American Saga - Chapter 1 released?,"'Horizon: An American Saga - Chapter 1' was released on June 26, 2024.",Answer the following question:
Who are the supporting actors in Horizon: An American Saga - Chapter 1?,"The supporting actors in 'Horizon: An American Saga - Chapter 1' are Sienna Miller, Sam Worthington, Jena Malone, Abbey Lee, Michael Rooker, Danny Huston, Luke Wilson, Ella Hunt, Tatanka Means.",Answer the following question:
What is the rating of Horizon: An American Saga - Chapter 1?,The rating of 'Horizon: An American Saga - Chapter 1' is 7.1.,Answer the following question:
What is the movie Horizon: An American Saga - Chapter 1 about?,"The film titled 'Horizon: An American Saga - Chapter 1' was released on June 26, 2024. It falls under the genres of Western, Drama. The film was directed by Kevin Costner and stars Kevin Costner, Sienna Miller, Sam Worthington, Jena Malone, Abbey Lee, Michael Rooker, Danny Huston, Luke Wilson, Ella Hunt, Tatanka Means. The lead actor is Kevin Costner. Plot summary: Follow the story of how the Old West was won--and lost--through the blood, sweat and tears of many. Spanning 15 years before, during and following the Civil War from 1859 to 1874, embark on an emotional journey across a country at war with itself, experienced through the lens of families, friends and foes all attempting to discover what it truly means to be the United States of America.. It has received a rating of 7.1.",Answer the following question:
What is the plot of The Last Kumite?,"The plot of 'The Last Kumite' is about When Karate champion Michael Rivers wins the last tournament of his career, shady businessman Ron Hall offers him the opportunity to fight in an illegal Kumite in Bulgaria against the world's best martial artists.  When Michael declines, Hall has his daughter kidnapped and, in order to rescue her, Rivers is left with no choice but to compete in the deadly tournament. Arriving in Bulgaria, he finds out that he is not the only fighter whose loved one was taken. Rivers enlists the help of trainers Master Loren, and Julie Jackson but will it be enough for him to win the tournament and save his daughter's life?.",Answer the following question:
Who are in the cast of The Last Kumite?,"The cast of 'The Last Kumite' includes Mathis Landwehr, Kurt McKinney, Billy Blanks, Matthias Hues, Cynthia Rothrock, Michel Qissi, David Kurzhal, Monia Moula, Mike Derudder, Abdel Qissi.",Answer the following question:
Who directed The Last Kumite?,'The Last Kumite' was directed by Ross W. Clarkson.,Answer the following question:
What are the genres of The Last Kumite?,The genres of 'The Last Kumite' are Action.,Answer the following question:
Who is the lead actor in The Last Kumite?,The lead actor in 'The Last Kumite' is Mathis Landwehr.,Answer the following question:
When was The Last Kumite released?,"'The Last Kumite' was released on May 09, 2024.",Answer the following question:
Who are the supporting actors in The Last Kumite?,"The supporting actors in 'The Last Kumite' are Kurt McKinney, Billy Blanks, Matthias Hues, Cynthia Rothrock, Michel Qissi, David Kurzhal, Monia Moula, Mike Derudder, Abdel Qissi.",Answer the following question:
What is the rating of The Last Kumite?,The rating of 'The Last Kumite' is 7.081.,Answer the following question:
What is the movie The Last Kumite about?,"The film titled 'The Last Kumite' was released on May 09, 2024. It falls under the genres of Action. The film was directed by Ross W. Clarkson and stars Mathis Landwehr, Kurt McKinney, Billy Blanks, Matthias Hues, Cynthia Rothrock, Michel Qissi, David Kurzhal, Monia Moula, Mike Derudder, Abdel Qissi. The lead actor is Mathis Landwehr. Plot summary: When Karate champion Michael Rivers wins the last tournament of his career, shady businessman Ron Hall offers him the opportunity to fight in an illegal Kumite in Bulgaria against the world's best martial artists.  When Michael declines, Hall has his daughter kidnapped and, in order to rescue her, Rivers is left with no choice but to compete in the deadly tournament. Arriving in Bulgaria, he finds out that he is not the only fighter whose loved one was taken. Rivers enlists the help of trainers Master Loren, and Julie Jackson but will it be enough for him to win the tournament and save his daughter's life?. It has received a rating of 7.081.",Answer the following question:
What is the plot of Autumn and the Black Jaguar?,"The plot of 'Autumn and the Black Jaguar' is about Grown up in the Amazon rainforest, Autumn lives with Hope, the cute baby jaguar she adopted. However, a circumstance forces Autumn to return to New York. Autumn goes back into the jungle to save Hope from grave danger..",Answer the following question:
Who are in the cast of Autumn and the Black Jaguar?,"The cast of 'Autumn and the Black Jaguar' includes Lumi Pollack, Emily Bett Rickards, Wayne Charles Baker, Paul Greene, Kelly Hope Taylor, Lucrezia Pini, Letitia Brookes, K.C. Coombs, Airam Camacho.",Answer the following question:
Who directed Autumn and the Black Jaguar?,'Autumn and the Black Jaguar' was directed by Gilles de Maistre.,Answer the following question:
What are the genres of Autumn and the Black Jaguar?,"The genres of 'Autumn and the Black Jaguar' are Adventure, Family.",Answer the following question:
Who is the lead actor in Autumn and the Black Jaguar?,The lead actor in 'Autumn and the Black Jaguar' is Lumi Pollack.,Answer the following question:
When was Autumn and the Black Jaguar released?,"'Autumn and the Black Jaguar' was released on February 01, 2024.",Answer the following question:
Who are the supporting actors in Autumn and the Black Jaguar?,"The supporting actors in 'Autumn and the Black Jaguar' are Emily Bett Rickards, Wayne Charles Baker, Paul Greene, Kelly Hope Taylor, Lucrezia Pini, Letitia Brookes, K.C. Coombs, Airam Camacho.",Answer the following question:
What is the rating of Autumn and the Black Jaguar?,The rating of 'Autumn and the Black Jaguar' is 5.554.,Answer the following question:
What is the movie Autumn and the Black Jaguar about?,"The film titled 'Autumn and the Black Jaguar' was released on February 01, 2024. It falls under the genres of Adventure, Family. The film was directed by Gilles de Maistre and stars Lumi Pollack, Emily Bett Rickards, Wayne Charles Baker, Paul Greene, Kelly Hope Taylor, Lucrezia Pini, Letitia Brookes, K.C. Coombs, Airam Camacho. The lead actor is Lumi Pollack. Plot summary: Grown up in the Amazon rainforest, Autumn lives with Hope, the cute baby jaguar she adopted. However, a circumstance forces Autumn to return to New York. Autumn goes back into the jungle to save Hope from grave danger.. It has received a rating of 5.554.",Answer the following question:
What is the plot of An Ideal Father?,"The plot of 'An Ideal Father' is about Michel, the jovial owner of the only cafe in a small Normandy town, sees his life turned upside down when his teenage daughter is murdered. The community has his back but soon rumor spreads and Michel is singled out. From the ideal father, he becomes the ideal culprit..",Answer the following question:
Who are in the cast of An Ideal Father?,"The cast of 'An Ideal Father' includes Laurent Gerra, Eddy Mitchell, Laure-Lucille Simon, Jerome Kircher, Tess Barthelemy, Berangere Bonvoisin, Denez Raoul, Alice Aliaga, Rufus.",Answer the following question:
Who directed An Ideal Father?,'An Ideal Father' was directed by Helene Fillieres.,Answer the following question:
What are the genres of An Ideal Father?,"The genres of 'An Ideal Father' are Drama, TV Movie.",Answer the following question:
Who is the lead actor in An Ideal Father?,The lead actor in 'An Ideal Father' is Laurent Gerra.,Answer the following question:
When was An Ideal Father released?,"'An Ideal Father' was released on April 21, 2024.",Answer the following question:
Who are the supporting actors in An Ideal Father?,"The supporting actors in 'An Ideal Father' are Eddy Mitchell, Laure-Lucille Simon, Jerome Kircher, Tess Barthelemy, Berangere Bonvoisin, Denez Raoul, Alice Aliaga, Rufus.",Answer the following question:
What is the rating of An Ideal Father?,The rating of 'An Ideal Father' is 6.4.,Answer the following question:
What is the movie An Ideal Father about?,"The film titled 'An Ideal Father' was released on April 21, 2024. It falls under the genres of Drama, TV Movie. The film was directed by Helene Fillieres and stars Laurent Gerra, Eddy Mitchell, Laure-Lucille Simon, Jerome Kircher, Tess Barthelemy, Berangere Bonvoisin, Denez Raoul, Alice Aliaga, Rufus. The lead actor is Laurent Gerra. Plot summary: Michel, the jovial owner of the only cafe in a small Normandy town, sees his life turned upside down when his teenage daughter is murdered. The community has his back but soon rumor spreads and Michel is singled out. From the ideal father, he becomes the ideal culprit.. It has received a rating of 6.4.",Answer the following question:
What is the plot of The Roundup: No Way Out?,"The plot of 'The Roundup: No Way Out' is about Detective Ma Seok-do changes his affiliation from the Geumcheon Police Station to the Metropolitan Investigation Team, in order to eradicate Japanese gangsters who enter Korea to commit heinous crimes..",Answer the following question:
Who are in the cast of The Roundup: No Way Out?,"The cast of 'The Roundup: No Way Out' includes Ma Dong-seok, Lee Jun-hyuk, Munetaka Aoki, Lee Beom-soo, Kim Min-jae, Lee Ji-hoon, Kim Do-gun, Go Gyu-pil, Jun Suk-ho, Jun Kunimura.",Answer the following question:
Who directed The Roundup: No Way Out?,'The Roundup: No Way Out' was directed by Lee Sang-yong.,Answer the following question:
What are the genres of The Roundup: No Way Out?,"The genres of 'The Roundup: No Way Out' are Action, Crime, Comedy, Thriller.",Answer the following question:
Who is the lead actor in The Roundup: No Way Out?,The lead actor in 'The Roundup: No Way Out' is Ma Dong-seok.,Answer the following question:
When was The Roundup: No Way Out released?,"'The Roundup: No Way Out' was released on May 31, 2023.",Answer the following question:
Who are the supporting actors in The Roundup: No Way Out?,"The supporting actors in 'The Roundup: No Way Out' are Lee Jun-hyuk, Munetaka Aoki, Lee Beom-soo, Kim Min-jae, Lee Ji-hoon, Kim Do-gun, Go Gyu-pil, Jun Suk-ho, Jun Kunimura.",Answer the following question:
What is the rating of The Roundup: No Way Out?,The rating of 'The Roundup: No Way Out' is 7.27.,Answer the following question:
What is the movie The Roundup: No Way Out about?,"The film titled 'The Roundup: No Way Out' was released on May 31, 2023. It falls under the genres of Action, Crime, Comedy, Thriller. The film was directed by Lee Sang-yong and stars Ma Dong-seok, Lee Jun-hyuk, Munetaka Aoki, Lee Beom-soo, Kim Min-jae, Lee Ji-hoon, Kim Do-gun, Go Gyu-pil, Jun Suk-ho, Jun Kunimura. The lead actor is Ma Dong-seok. Plot summary: Detective Ma Seok-do changes his affiliation from the Geumcheon Police Station to the Metropolitan Investigation Team, in order to eradicate Japanese gangsters who enter Korea to commit heinous crimes.. It has received a rating of 7.27.",Answer the following question:
What is the plot of The Inheritance?,"The plot of 'The Inheritance' is about Billionaire Charles Abernathy, on the eve of his 75th birthday, invites his four estranged children back home out of fear that tonight someone - or something - is coming to kill him. To ensure his family will help protect him from whatever's coming, Abernathy puts each of their inheritances on the line - they'll get nothing if he's found dead by dawn..",Answer the following question:
Who are in the cast of The Inheritance?,"The cast of 'The Inheritance' includes Bob Gunton, Peyton List, Briana Middleton, Rachel Nichols, Austin Stowell, David Walton, Reese Alexander, Keith Arbuthnot, Chris Wood.",Answer the following question:
Who directed The Inheritance?,'The Inheritance' was directed by Alejandro Brugues.,Answer the following question:
What are the genres of The Inheritance?,The genres of 'The Inheritance' are Horror.,Answer the following question:
Who is the lead actor in The Inheritance?,The lead actor in 'The Inheritance' is Bob Gunton.,Answer the following question:
When was The Inheritance released?,"'The Inheritance' was released on July 12, 2024.",Answer the following question:
Who are the supporting actors in The Inheritance?,"The supporting actors in 'The Inheritance' are Peyton List, Briana Middleton, Rachel Nichols, Austin Stowell, David Walton, Reese Alexander, Keith Arbuthnot, Chris Wood.",Answer the following question:
What is the rating of The Inheritance?,The rating of 'The Inheritance' is 5.5.,Answer the following question:
What is the movie The Inheritance about?,"The film titled 'The Inheritance' was released on July 12, 2024. It falls under the genres of Horror. The film was directed by Alejandro Brugues and stars Bob Gunton, Peyton List, Briana Middleton, Rachel Nichols, Austin Stowell, David Walton, Reese Alexander, Keith Arbuthnot, Chris Wood. The lead actor is Bob Gunton. Plot summary: Billionaire Charles Abernathy, on the eve of his 75th birthday, invites his four estranged children back home out of fear that tonight someone - or something - is coming to kill him. To ensure his family will help protect him from whatever's coming, Abernathy puts each of their inheritances on the line - they'll get nothing if he's found dead by dawn.. It has received a rating of 5.5.",Answer the following question:
What is the plot of The Fall Guy?,"The plot of 'The Fall Guy' is about Fresh off an almost career-ending accident, stuntman Colt Seavers has to track down a missing movie star, solve a conspiracy and try to win back the love of his life while still doing his day job..",Answer the following question:
Who are in the cast of The Fall Guy?,"The cast of 'The Fall Guy' includes Ryan Gosling, Emily Blunt, Aaron Taylor-Johnson, Hannah Waddingham, Teresa Palmer, Stephanie Hsu, Winston Duke, Ben Knight, Matuse Paz, Adam Dunn.",Answer the following question:
Who directed The Fall Guy?,'The Fall Guy' was directed by David Leitch.,Answer the following question:
