question,answer,instruction
What are the genres of The Fall Guy?,"The genres of 'The Fall Guy' are Action, Comedy.",Answer the following question:
Who is the lead actor in The Fall Guy?,The lead actor in 'The Fall Guy' is Ryan Gosling.,Answer the following question:
When was The Fall Guy released?,"'The Fall Guy' was released on April 24, 2024.",Answer the following question:
Who are the supporting actors in The Fall Guy?,"The supporting actors in 'The Fall Guy' are Emily Blunt, Aaron Taylor-Johnson, Hannah Waddingham, Teresa Palmer, Stephanie Hsu, Winston Duke, Ben Knight, Matuse Paz, Adam Dunn.",Answer the following question:
What is the rating of The Fall Guy?,The rating of 'The Fall Guy' is 7.224.,Answer the following question:
What is the movie The Fall Guy about?,"The film titled 'The Fall Guy' was released on April 24, 2024. It falls under the genres of Action, Comedy. The film was directed by David Leitch and stars Ryan Gosling, Emily Blunt, Aaron Taylor-Johnson, Hannah Waddingham, Teresa Palmer, Stephanie Hsu, Winston Duke, Ben Knight, Matuse Paz, Adam Dunn. The lead actor is Ryan Gosling. Plot summary: Fresh off an almost career-ending accident, stuntman Colt Seavers has to track down a missing movie star, solve a conspiracy and try to win back the love of his life while still doing his day job.. It has received a rating of 7.224.",Answer the following question:
What is the plot of IF?,The plot of 'IF' is about A young girl who goes through a difficult experience begins to see everyone's imaginary friends who have been left behind as their real-life friends have grown up..,Answer the following question:
Who are in the cast of IF?,"The cast of 'IF' includes Cailey Fleming, Ryan Reynolds, John Krasinski, Fiona Shaw, Steve Carell, Phoebe Waller-Bridge, Louis Gossett Jr., Alan Kim, Liza Colon-Zayas, Bobby Moynihan.",Answer the following question:
Who directed IF?,'IF' was directed by John Krasinski.,Answer the following question:
What are the genres of IF?,"The genres of 'IF' are Comedy, Fantasy, Family.",Answer the following question:
Who is the lead actor in IF?,The lead actor in 'IF' is Cailey Fleming.,Answer the following question:
When was IF released?,"'IF' was released on May 08, 2024.",Answer the following question:
Who are the supporting actors in IF?,"The supporting actors in 'IF' are Ryan Reynolds, John Krasinski, Fiona Shaw, Steve Carell, Phoebe Waller-Bridge, Louis Gossett Jr., Alan Kim, Liza Colon-Zayas, Bobby Moynihan.",Answer the following question:
What is the rating of IF?,The rating of 'IF' is 7.37.,Answer the following question:
What is the movie IF about?,"The film titled 'IF' was released on May 08, 2024. It falls under the genres of Comedy, Fantasy, Family. The film was directed by John Krasinski and stars Cailey Fleming, Ryan Reynolds, John Krasinski, Fiona Shaw, Steve Carell, Phoebe Waller-Bridge, Louis Gossett Jr., Alan Kim, Liza Colon-Zayas, Bobby Moynihan. The lead actor is Cailey Fleming. Plot summary: A young girl who goes through a difficult experience begins to see everyone's imaginary friends who have been left behind as their real-life friends have grown up.. It has received a rating of 7.37.",Answer the following question:
What is the plot of Justice League: Crisis on Infinite Earths Part Three?,"The plot of 'Justice League: Crisis on Infinite Earths Part Three' is about Now fully revealed as the ultimate threat to existence, the Anti-Monitor wages an unrelenting attack on the surviving Earths that struggle for survival in a pocket universe. One by one, these worlds and all their inhabitants are vaporized! On the planets that remain, even time itself is shattered, and heroes from the past join the Justice League and their rag-tag allies against the epitome of evil. But as they make their last stand, will the sacrifice of the superheroes be enough to save us all?.",Answer the following question:
Who are in the cast of Justice League: Crisis on Infinite Earths Part Three?,"The cast of 'Justice League: Crisis on Infinite Earths Part Three' includes Jensen Ackles, Darren Criss, Corey Stoll, Gideon Adlon, Ike Amadi, Geoffrey Arend, Troy Baker, Brian Bloom, Matt Bomer, Ashly Burch.",Answer the following question:
Who directed Justice League: Crisis on Infinite Earths Part Three?,'Justice League: Crisis on Infinite Earths Part Three' was directed by Jeff Wamester.,Answer the following question:
What are the genres of Justice League: Crisis on Infinite Earths Part Three?,"The genres of 'Justice League: Crisis on Infinite Earths Part Three' are Animation, Science Fiction, Action.",Answer the following question:
Who is the lead actor in Justice League: Crisis on Infinite Earths Part Three?,The lead actor in 'Justice League: Crisis on Infinite Earths Part Three' is Jensen Ackles.,Answer the following question:
When was Justice League: Crisis on Infinite Earths Part Three released?,"'Justice League: Crisis on Infinite Earths Part Three' was released on July 16, 2024.",Answer the following question:
Who are the supporting actors in Justice League: Crisis on Infinite Earths Part Three?,"The supporting actors in 'Justice League: Crisis on Infinite Earths Part Three' are Darren Criss, Corey Stoll, Gideon Adlon, Ike Amadi, Geoffrey Arend, Troy Baker, Brian Bloom, Matt Bomer, Ashly Burch.",Answer the following question:
What is the rating of Justice League: Crisis on Infinite Earths Part Three?,The rating of 'Justice League: Crisis on Infinite Earths Part Three' is 7.605.,Answer the following question:
What is the movie Justice League: Crisis on Infinite Earths Part Three about?,"The film titled 'Justice League: Crisis on Infinite Earths Part Three' was released on July 16, 2024. It falls under the genres of Animation, Science Fiction, Action. The film was directed by Jeff Wamester and stars Jensen Ackles, Darren Criss, Corey Stoll, Gideon Adlon, Ike Amadi, Geoffrey Arend, Troy Baker, Brian Bloom, Matt Bomer, Ashly Burch. The lead actor is Jensen Ackles. Plot summary: Now fully revealed as the ultimate threat to existence, the Anti-Monitor wages an unrelenting attack on the surviving Earths that struggle for survival in a pocket universe. One by one, these worlds and all their inhabitants are vaporized! On the planets that remain, even time itself is shattered, and heroes from the past join the Justice League and their rag-tag allies against the epitome of evil. But as they make their last stand, will the sacrifice of the superheroes be enough to save us all?. It has received a rating of 7.605.",Answer the following question:
What is the plot of xXx?,"The plot of 'xXx' is about Xander Cage is your standard adrenaline junkie with no fear and a lousy attitude. When the US Government ""recruits"" him to go on a mission, he's not exactly thrilled. His mission: to gather information on an organization that may just be planning the destruction of the world, led by the nihilistic Yorgi..",Answer the following question:
Who are in the cast of xXx?,"The cast of 'xXx' includes Vin Diesel, Asia Argento, Marton Csokas, Samuel L. Jackson, Michael Roof, Richy Muller, Werner Daehn, Petr Jakl, Jan Filipensky, Tom Everett.",Answer the following question:
Who directed xXx?,'xXx' was directed by Rob Cohen.,Answer the following question:
What are the genres of xXx?,"The genres of 'xXx' are Action, Adventure, Thriller, Crime.",Answer the following question:
Who is the lead actor in xXx?,The lead actor in 'xXx' is Vin Diesel.,Answer the following question:
When was xXx released?,"'xXx' was released on August 09, 2002.",Answer the following question:
Who are the supporting actors in xXx?,"The supporting actors in 'xXx' are Asia Argento, Marton Csokas, Samuel L. Jackson, Michael Roof, Richy Muller, Werner Daehn, Petr Jakl, Jan Filipensky, Tom Everett.",Answer the following question:
What is the rating of xXx?,The rating of 'xXx' is 5.9.,Answer the following question:
What is the movie xXx about?,"The film titled 'xXx' was released on August 09, 2002. It falls under the genres of Action, Adventure, Thriller, Crime. The film was directed by Rob Cohen and stars Vin Diesel, Asia Argento, Marton Csokas, Samuel L. Jackson, Michael Roof, Richy Muller, Werner Daehn, Petr Jakl, Jan Filipensky, Tom Everett. The lead actor is Vin Diesel. Plot summary: Xander Cage is your standard adrenaline junkie with no fear and a lousy attitude. When the US Government ""recruits"" him to go on a mission, he's not exactly thrilled. His mission: to gather information on an organization that may just be planning the destruction of the world, led by the nihilistic Yorgi.. It has received a rating of 5.9.",Answer the following question:
What is the plot of The Watchers?,"The plot of 'The Watchers' is about A young artist gets stranded in an extensive, immaculate forest in western Ireland, where, after finding shelter, she becomes trapped alongside three strangers, stalked by mysterious creatures each night..",Answer the following question:
Who are in the cast of The Watchers?,"The cast of 'The Watchers' includes Dakota Fanning, Georgina Campbell, Olwen Fouere, Oliver Finnegan, Alistair Brammer, John Lynch, Siobhan Hewlett, Hannah Dargan, Emily Dargan, Joel Figueroa.",Answer the following question:
Who directed The Watchers?,'The Watchers' was directed by Ishana Night Shyamalan.,Answer the following question:
What are the genres of The Watchers?,"The genres of 'The Watchers' are Fantasy, Mystery, Thriller, Horror.",Answer the following question:
Who is the lead actor in The Watchers?,The lead actor in 'The Watchers' is Dakota Fanning.,Answer the following question:
When was The Watchers released?,"'The Watchers' was released on June 06, 2024.",Answer the following question:
Who are the supporting actors in The Watchers?,"The supporting actors in 'The Watchers' are Georgina Campbell, Olwen Fouere, Oliver Finnegan, Alistair Brammer, John Lynch, Siobhan Hewlett, Hannah Dargan, Emily Dargan, Joel Figueroa.",Answer the following question:
What is the rating of The Watchers?,The rating of 'The Watchers' is 6.535.,Answer the following question:
What is the movie The Watchers about?,"The film titled 'The Watchers' was released on June 06, 2024. It falls under the genres of Fantasy, Mystery, Thriller, Horror. The film was directed by Ishana Night Shyamalan and stars Dakota Fanning, Georgina Campbell, Olwen Fouere, Oliver Finnegan, Alistair Brammer, John Lynch, Siobhan Hewlett, Hannah Dargan, Emily Dargan, Joel Figueroa. The lead actor is Dakota Fanning. Plot summary: A young artist gets stranded in an extensive, immaculate forest in western Ireland, where, after finding shelter, she becomes trapped alongside three strangers, stalked by mysterious creatures each night.. It has received a rating of 6.535.",Answer the following question:
What is the plot of Migration?,"The plot of 'Migration' is about After a migrating duck family alights on their pond with thrilling tales of far-flung places, the Mallard family embarks on a family road trip, from New England, to New York City, to tropical Jamaica..",Answer the following question:
Who are in the cast of Migration?,"The cast of 'Migration' includes Kumail Nanjiani, Elizabeth Banks, Caspar Jennings, Tresi Gazal, Awkwafina, Carol Kane, Keegan-Michael Key, Danny DeVito, David Mitchell, Isabela Merced.",Answer the following question:
Who directed Migration?,'Migration' was directed by Benjamin Renner.,Answer the following question:
What are the genres of Migration?,"The genres of 'Migration' are Animation, Action, Adventure, Comedy, Family.",Answer the following question:
Who is the lead actor in Migration?,The lead actor in 'Migration' is Kumail Nanjiani.,Answer the following question:
When was Migration released?,"'Migration' was released on December 06, 2023.",Answer the following question:
Who are the supporting actors in Migration?,"The supporting actors in 'Migration' are Elizabeth Banks, Caspar Jennings, Tresi Gazal, Awkwafina, Carol Kane, Keegan-Michael Key, Danny DeVito, David Mitchell, Isabela Merced.",Answer the following question:
What is the rating of Migration?,The rating of 'Migration' is 7.464.,Answer the following question:
What is the movie Migration about?,"The film titled 'Migration' was released on December 06, 2023. It falls under the genres of Animation, Action, Adventure, Comedy, Family. The film was directed by Benjamin Renner and stars Kumail Nanjiani, Elizabeth Banks, Caspar Jennings, Tresi Gazal, Awkwafina, Carol Kane, Keegan-Michael Key, Danny DeVito, David Mitchell, Isabela Merced. The lead actor is Kumail Nanjiani. Plot summary: After a migrating duck family alights on their pond with thrilling tales of far-flung places, the Mallard family embarks on a family road trip, from New England, to New York City, to tropical Jamaica.. It has received a rating of 7.464.",Answer the following question:
What is the plot of Immaculate?,"The plot of 'Immaculate' is about An American nun embarks on a new journey when she joins a remote convent in the Italian countryside. However, her warm welcome quickly turns into a living nightmare when she discovers her new home harbours a sinister secret and unspeakable horrors..",Answer the following question:
Who are in the cast of Immaculate?,"The cast of 'Immaculate' includes Sydney Sweeney, Alvaro Morte, Benedetta Porcaroli, Dora Romano, Giorgio Colangeli, Simona Tabasco, Giampiero Judica, Niccolo Senni, Giulia Heathfield Di Renzi, Giampiero Judica.",Answer the following question:
Who directed Immaculate?,'Immaculate' was directed by Michael Mohan.,Answer the following question:
What are the genres of Immaculate?,"The genres of 'Immaculate' are Horror, Mystery, Thriller.",Answer the following question:
Who is the lead actor in Immaculate?,The lead actor in 'Immaculate' is Sydney Sweeney.,Answer the following question:
When was Immaculate released?,"'Immaculate' was released on March 20, 2024.",Answer the following question:
Who are the supporting actors in Immaculate?,"The supporting actors in 'Immaculate' are Alvaro Morte, Benedetta Porcaroli, Dora Romano, Giorgio Colangeli, Simona Tabasco, Giampiero Judica, Niccolo Senni, Giulia Heathfield Di Renzi, Giampiero Judica.",Answer the following question:
What is the rating of Immaculate?,The rating of 'Immaculate' is 6.315.,Answer the following question:
What is the movie Immaculate about?,"The film titled 'Immaculate' was released on March 20, 2024. It falls under the genres of Horror, Mystery, Thriller. The film was directed by Michael Mohan and stars Sydney Sweeney, Alvaro Morte, Benedetta Porcaroli, Dora Romano, Giorgio Colangeli, Simona Tabasco, Giampiero Judica, Niccolo Senni, Giulia Heathfield Di Renzi, Giampiero Judica. The lead actor is Sydney Sweeney. Plot summary: An American nun embarks on a new journey when she joins a remote convent in the Italian countryside. However, her warm welcome quickly turns into a living nightmare when she discovers her new home harbours a sinister secret and unspeakable horrors.. It has received a rating of 6.315.",Answer the following question:
What is the plot of Tarot?,"The plot of 'Tarot' is about When a group of friends recklessly violate the sacred rule of Tarot readings, they unknowingly unleash an unspeakable evil trapped within the cursed cards. One by one, they come face to face with fate and end up in a race against death..",Answer the following question:
Who are in the cast of Tarot?,"The cast of 'Tarot' includes Harriet Slater, Adain Bradley, Avantika, Jacob Batalon, Humberly Gonzalez, Wolfgang Novogratz, Larsen Thompson, Olwen Fouere, Suncica Milanovic, Alan Wells.",Answer the following question:
Who directed Tarot?,"'Tarot' was directed by Spenser Cohen, Anna Halberg.",Answer the following question:
What are the genres of Tarot?,The genres of 'Tarot' are Horror.,Answer the following question:
Who is the lead actor in Tarot?,The lead actor in 'Tarot' is Harriet Slater.,Answer the following question:
When was Tarot released?,"'Tarot' was released on May 01, 2024.",Answer the following question:
Who are the supporting actors in Tarot?,"The supporting actors in 'Tarot' are Adain Bradley, Avantika, Jacob Batalon, Humberly Gonzalez, Wolfgang Novogratz, Larsen Thompson, Olwen Fouere, Suncica Milanovic, Alan Wells.",Answer the following question:
What is the rating of Tarot?,The rating of 'Tarot' is 6.693.,Answer the following question:
What is the movie Tarot about?,"The film titled 'Tarot' was released on May 01, 2024. It falls under the genres of Horror. The film was directed by Spenser Cohen, Anna Halberg and stars Harriet Slater, Adain Bradley, Avantika, Jacob Batalon, Humberly Gonzalez, Wolfgang Novogratz, Larsen Thompson, Olwen Fouere, Suncica Milanovic, Alan Wells. The lead actor is Harriet Slater. Plot summary: When a group of friends recklessly violate the sacred rule of Tarot readings, they unknowingly unleash an unspeakable evil trapped within the cursed cards. One by one, they come face to face with fate and end up in a race against death.. It has received a rating of 6.693.",Answer the following question:
What is the plot of The Strangers: Chapter 1?,"The plot of 'The Strangers: Chapter 1' is about After their car breaks down in an eerie small town, a young couple are forced to spend the night in a remote cabin. Panic ensues as they are terrorized by three masked strangers who strike with no mercy and seemingly no motives..",Answer the following question:
Who are in the cast of The Strangers: Chapter 1?,"The cast of 'The Strangers: Chapter 1' includes Madelaine Petsch, Froy Gutierrez, Gabriel Basso, Ema Horvath, Richard Brake, Rachel Shenton, Ella Bruccoleri, George Young, Janis Ahern, Pedro Leandro.",Answer the following question:
Who directed The Strangers: Chapter 1?,'The Strangers: Chapter 1' was directed by Renny Harlin.,Answer the following question:
What are the genres of The Strangers: Chapter 1?,"The genres of 'The Strangers: Chapter 1' are Horror, Thriller.",Answer the following question:
Who is the lead actor in The Strangers: Chapter 1?,The lead actor in 'The Strangers: Chapter 1' is Madelaine Petsch.,Answer the following question:
When was The Strangers: Chapter 1 released?,"'The Strangers: Chapter 1' was released on May 15, 2024.",Answer the following question:
Who are the supporting actors in The Strangers: Chapter 1?,"The supporting actors in 'The Strangers: Chapter 1' are Froy Gutierrez, Gabriel Basso, Ema Horvath, Richard Brake, Rachel Shenton, Ella Bruccoleri, George Young, Janis Ahern, Pedro Leandro.",Answer the following question:
What is the rating of The Strangers: Chapter 1?,The rating of 'The Strangers: Chapter 1' is 5.8.,Answer the following question:
What is the movie The Strangers: Chapter 1 about?,"The film titled 'The Strangers: Chapter 1' was released on May 15, 2024. It falls under the genres of Horror, Thriller. The film was directed by Renny Harlin and stars Madelaine Petsch, Froy Gutierrez, Gabriel Basso, Ema Horvath, Richard Brake, Rachel Shenton, Ella Bruccoleri, George Young, Janis Ahern, Pedro Leandro. The lead actor is Madelaine Petsch. Plot summary: After their car breaks down in an eerie small town, a young couple are forced to spend the night in a remote cabin. Panic ensues as they are terrorized by three masked strangers who strike with no mercy and seemingly no motives.. It has received a rating of 5.8.",Answer the following question:
What is the plot of Atlas?,The plot of 'Atlas' is about A brilliant counterterrorism analyst with a deep distrust of AI discovers it might be her only hope when a mission to capture a renegade robot goes awry..,Answer the following question:
Who are in the cast of Atlas?,"The cast of 'Atlas' includes Jennifer Lopez, Simu Liu, Sterling K. Brown, Gregory James Cohan, Abraham Popoola, Lana Parrilla, Mark Strong, Briella Guiza, Adia Smith-Eriksson, Logan Hunt.",Answer the following question:
Who directed Atlas?,'Atlas' was directed by Brad Peyton.,Answer the following question:
What are the genres of Atlas?,"The genres of 'Atlas' are Science Fiction, Action.",Answer the following question:
Who is the lead actor in Atlas?,The lead actor in 'Atlas' is Jennifer Lopez.,Answer the following question:
When was Atlas released?,"'Atlas' was released on May 23, 2024.",Answer the following question:
Who are the supporting actors in Atlas?,"The supporting actors in 'Atlas' are Simu Liu, Sterling K. Brown, Gregory James Cohan, Abraham Popoola, Lana Parrilla, Mark Strong, Briella Guiza, Adia Smith-Eriksson, Logan Hunt.",Answer the following question:
What is the rating of Atlas?,The rating of 'Atlas' is 6.855.,Answer the following question:
What is the movie Atlas about?,"The film titled 'Atlas' was released on May 23, 2024. It falls under the genres of Science Fiction, Action. The film was directed by Brad Peyton and stars Jennifer Lopez, Simu Liu, Sterling K. Brown, Gregory James Cohan, Abraham Popoola, Lana Parrilla, Mark Strong, Briella Guiza, Adia Smith-Eriksson, Logan Hunt. The lead actor is Jennifer Lopez. Plot summary: A brilliant counterterrorism analyst with a deep distrust of AI discovers it might be her only hope when a mission to capture a renegade robot goes awry.. It has received a rating of 6.855.",Answer the following question:
"What is the plot of Run, Tiger Run!?","The plot of 'Run, Tiger Run!' is about The film follows a young boy who sets out on a mission to try and track down his long lost parents..",Answer the following question:
"Who are in the cast of Run, Tiger Run!?","The cast of 'Run, Tiger Run!' includes Nianci Shen, Dawei Liang, Liang Zou, Jianru Zhang, Lu Qi, Qimin Cao, Shi Chen, Sheng Dian, Sheng Dian, Xiaoyu Gao.",Answer the following question:
"Who directed Run, Tiger Run!?","'Run, Tiger Run!' was directed by Stanley Tsang, Joey Zou.",Answer the following question:
"What are the genres of Run, Tiger Run!?","The genres of 'Run, Tiger Run!' are Animation, Adventure, Comedy, Action, Family.",Answer the following question:
"Who is the lead actor in Run, Tiger Run!?","The lead actor in 'Run, Tiger Run!' is Nianci Shen.",Answer the following question:
"When was Run, Tiger Run! released?","'Run, Tiger Run!' was released on February 01, 2022.",Answer the following question:
"Who are the supporting actors in Run, Tiger Run!?","The supporting actors in 'Run, Tiger Run!' are Dawei Liang, Liang Zou, Jianru Zhang, Lu Qi, Qimin Cao, Shi Chen, Sheng Dian, Sheng Dian, Xiaoyu Gao.",Answer the following question:
"What is the rating of Run, Tiger Run!?","The rating of 'Run, Tiger Run!' is 7.222.",Answer the following question:
"What is the movie Run, Tiger Run! about?","The film titled 'Run, Tiger Run!' was released on February 01, 2022. It falls under the genres of Animation, Adventure, Comedy, Action, Family. The film was directed by Stanley Tsang, Joey Zou and stars Nianci Shen, Dawei Liang, Liang Zou, Jianru Zhang, Lu Qi, Qimin Cao, Shi Chen, Sheng Dian, Sheng Dian, Xiaoyu Gao. The lead actor is Nianci Shen. Plot summary: The film follows a young boy who sets out on a mission to try and track down his long lost parents.. It has received a rating of 7.222.",Answer the following question:
"What is the plot of Miraculous World: Paris, Tales of Shadybug and Claw Noir?","The plot of 'Miraculous World: Paris, Tales of Shadybug and Claw Noir' is about Miraculous holders from another world appear in Paris. They come from a parallel universe where everything is reversed: the holders of Ladybug and Black Cat Miraculouses, Shadybug and Claw Noir, are the bad guys, and the holder of the Butterfly Miraculous, Hesperia, is a superhero. Ladybug and Cat Noir will have to help Hesperia counter the attacks of their evil doubles and prevent them from seizing the Butterfly's Miraculous. Can our heroes also help Hesperia make Shadybug and Claw Noir better people?.",Answer the following question:
"Who are in the cast of Miraculous World: Paris, Tales of Shadybug and Claw Noir?","The cast of 'Miraculous World: Paris, Tales of Shadybug and Claw Noir' includes Annouck Hautbois, Benjamin Bollen, Marie Nonnenmacher, Thierry Kazazian, Fanny Bloc, Antoine Tome, Alexandre N'Guyen, Martial Le Minoux, Jessie Lambotte, Celine Melloul.",Answer the following question:
"Who directed Miraculous World: Paris, Tales of Shadybug and Claw Noir?","'Miraculous World: Paris, Tales of Shadybug and Claw Noir' was directed by Thomas Astruc.",Answer the following question:
"What are the genres of Miraculous World: Paris, Tales of Shadybug and Claw Noir?","The genres of 'Miraculous World: Paris, Tales of Shadybug and Claw Noir' are Animation, Adventure, Action, Fantasy, Family.",Answer the following question:
"Who is the lead actor in Miraculous World: Paris, Tales of Shadybug and Claw Noir?","The lead actor in 'Miraculous World: Paris, Tales of Shadybug and Claw Noir' is Annouck Hautbois.",Answer the following question:
"When was Miraculous World: Paris, Tales of Shadybug and Claw Noir released?","'Miraculous World: Paris, Tales of Shadybug and Claw Noir' was released on October 21, 2023.",Answer the following question:
"Who are the supporting actors in Miraculous World: Paris, Tales of Shadybug and Claw Noir?","The supporting actors in 'Miraculous World: Paris, Tales of Shadybug and Claw Noir' are Benjamin Bollen, Marie Nonnenmacher, Thierry Kazazian, Fanny Bloc, Antoine Tome, Alexandre N'Guyen, Martial Le Minoux, Jessie Lambotte, Celine Melloul.",Answer the following question:
"What is the rating of Miraculous World: Paris, Tales of Shadybug and Claw Noir?","The rating of 'Miraculous World: Paris, Tales of Shadybug and Claw Noir' is 7.339.",Answer the following question:
