question,answer,instruction
What is the plot of Alice in Terrorland?,"The plot of 'Alice in Terrorland' is about A recently bereaved teenage girl goes to live with her aunt in a secluded woodland house, unaware that sinister forces lurk within..",Answer the following question:
Who are in the cast of Alice in Terrorland?,"The cast of 'Alice in Terrorland' includes Lizzy Willis, Rula Lenska, Jon-Paul Gates, Steve Wraith, Lila Sarner, Nigel Troup, Nikol Atanasova, Rikki Kimpton.",Answer the following question:
Who directed Alice in Terrorland?,'Alice in Terrorland' was directed by Richard John Taylor.,Answer the following question:
What are the genres of Alice in Terrorland?,"The genres of 'Alice in Terrorland' are Horror, Thriller.",Answer the following question:
Who is the lead actor in Alice in Terrorland?,The lead actor in 'Alice in Terrorland' is Lizzy Willis.,Answer the following question:
When was Alice in Terrorland released?,"'Alice in Terrorland' was released on December 26, 2023.",Answer the following question:
Who are the supporting actors in Alice in Terrorland?,"The supporting actors in 'Alice in Terrorland' are Rula Lenska, Jon-Paul Gates, Steve Wraith, Lila Sarner, Nigel Troup, Nikol Atanasova, Rikki Kimpton.",Answer the following question:
What is the rating of Alice in Terrorland?,The rating of 'Alice in Terrorland' is 6.033.,Answer the following question:
What is the movie Alice in Terrorland about?,"The film titled 'Alice in Terrorland' was released on December 26, 2023. It falls under the genres of Horror, Thriller. The film was directed by Richard John Taylor and stars Lizzy Willis, Rula Lenska, Jon-Paul Gates, Steve Wraith, Lila Sarner, Nigel Troup, Nikol Atanasova, Rikki Kimpton. The lead actor is Lizzy Willis. Plot summary: A recently bereaved teenage girl goes to live with her aunt in a secluded woodland house, unaware that sinister forces lurk within.. It has received a rating of 6.033.",Answer the following question:
What is the plot of Deadpool & Wolverine?,"The plot of 'Deadpool & Wolverine' is about A listless Wade Wilson toils away in civilian life with his days as the morally flexible mercenary, Deadpool, behind him. But when his homeworld faces an existential threat, Wade must reluctantly suit-up again with an even more reluctant Wolverine..",Answer the following question:
Who are in the cast of Deadpool & Wolverine?,"The cast of 'Deadpool & Wolverine' includes Ryan Reynolds, Hugh Jackman, Emma Corrin, Matthew Macfadyen, Morena Baccarin, Rob Delaney, Leslie Uggams, Karan Soni, Brianna Hildebrand, Shioli Kutsuna.",Answer the following question:
Who directed Deadpool & Wolverine?,'Deadpool & Wolverine' was directed by Shawn Levy.,Answer the following question:
What are the genres of Deadpool & Wolverine?,"The genres of 'Deadpool & Wolverine' are Science Fiction, Action, Comedy.",Answer the following question:
Who is the lead actor in Deadpool & Wolverine?,The lead actor in 'Deadpool & Wolverine' is Ryan Reynolds.,Answer the following question:
When was Deadpool & Wolverine released?,"'Deadpool & Wolverine' was released on July 24, 2024.",Answer the following question:
Who are the supporting actors in Deadpool & Wolverine?,"The supporting actors in 'Deadpool & Wolverine' are Hugh Jackman, Emma Corrin, Matthew Macfadyen, Morena Baccarin, Rob Delaney, Leslie Uggams, Karan Soni, Brianna Hildebrand, Shioli Kutsuna.",Answer the following question:
What is the rating of Deadpool & Wolverine?,The rating of 'Deadpool & Wolverine' is 0.0.,Answer the following question:
What is the movie Deadpool & Wolverine about?,"The film titled 'Deadpool & Wolverine' was released on July 24, 2024. It falls under the genres of Science Fiction, Action, Comedy. The film was directed by Shawn Levy and stars Ryan Reynolds, Hugh Jackman, Emma Corrin, Matthew Macfadyen, Morena Baccarin, Rob Delaney, Leslie Uggams, Karan Soni, Brianna Hildebrand, Shioli Kutsuna. The lead actor is Ryan Reynolds. Plot summary: A listless Wade Wilson toils away in civilian life with his days as the morally flexible mercenary, Deadpool, behind him. But when his homeworld faces an existential threat, Wade must reluctantly suit-up again with an even more reluctant Wolverine.. It has received a rating of 0.0.",Answer the following question:
What is the plot of Godzilla x Kong: The New Empire?,"The plot of 'Godzilla x Kong: The New Empire' is about Following their explosive showdown, Godzilla and Kong must reunite against a colossal undiscovered threat hidden within our world, challenging their very existence - and our own..",Answer the following question:
Who are in the cast of Godzilla x Kong: The New Empire?,"The cast of 'Godzilla x Kong: The New Empire' includes Rebecca Hall, Brian Tyree Henry, Dan Stevens, Kaylee Hottle, Alex Ferns, Fala Chen, Rachel House, Ron Smyck, Chantelle Jamieson, Greg Hatton.",Answer the following question:
Who directed Godzilla x Kong: The New Empire?,'Godzilla x Kong: The New Empire' was directed by Adam Wingard.,Answer the following question:
What are the genres of Godzilla x Kong: The New Empire?,"The genres of 'Godzilla x Kong: The New Empire' are Science Fiction, Action, Adventure.",Answer the following question:
Who is the lead actor in Godzilla x Kong: The New Empire?,The lead actor in 'Godzilla x Kong: The New Empire' is Rebecca Hall.,Answer the following question:
When was Godzilla x Kong: The New Empire released?,"'Godzilla x Kong: The New Empire' was released on March 27, 2024.",Answer the following question:
Who are the supporting actors in Godzilla x Kong: The New Empire?,"The supporting actors in 'Godzilla x Kong: The New Empire' are Brian Tyree Henry, Dan Stevens, Kaylee Hottle, Alex Ferns, Fala Chen, Rachel House, Ron Smyck, Chantelle Jamieson, Greg Hatton.",Answer the following question:
What is the rating of Godzilla x Kong: The New Empire?,The rating of 'Godzilla x Kong: The New Empire' is 7.191.,Answer the following question:
What is the movie Godzilla x Kong: The New Empire about?,"The film titled 'Godzilla x Kong: The New Empire' was released on March 27, 2024. It falls under the genres of Science Fiction, Action, Adventure. The film was directed by Adam Wingard and stars Rebecca Hall, Brian Tyree Henry, Dan Stevens, Kaylee Hottle, Alex Ferns, Fala Chen, Rachel House, Ron Smyck, Chantelle Jamieson, Greg Hatton. The lead actor is Rebecca Hall. Plot summary: Following their explosive showdown, Godzilla and Kong must reunite against a colossal undiscovered threat hidden within our world, challenging their very existence - and our own.. It has received a rating of 7.191.",Answer the following question:
What is the plot of Goyo?,"The plot of 'Goyo' is about A young autistic museum guide lives by a strict routine -- until he falls in love with his coworker and must confront a whirlwind of new, intense emotions..",Answer the following question:
Who are in the cast of Goyo?,"The cast of 'Goyo' includes Nicolas Furtado, Nancy Duplaa, Soledad Villamil, Pablo Rago, Cecilia Roth, Diego Alonso, Milo Zeus Lis, Balthazar Murillo, Javier Linares, Graciana Urbani.",Answer the following question:
Who directed Goyo?,'Goyo' was directed by Marcos Carnevale.,Answer the following question:
What are the genres of Goyo?,"The genres of 'Goyo' are Drama, Romance, Comedy.",Answer the following question:
Who is the lead actor in Goyo?,The lead actor in 'Goyo' is Nicolas Furtado.,Answer the following question:
When was Goyo released?,"'Goyo' was released on June 27, 2024.",Answer the following question:
Who are the supporting actors in Goyo?,"The supporting actors in 'Goyo' are Nancy Duplaa, Soledad Villamil, Pablo Rago, Cecilia Roth, Diego Alonso, Milo Zeus Lis, Balthazar Murillo, Javier Linares, Graciana Urbani.",Answer the following question:
What is the rating of Goyo?,The rating of 'Goyo' is 6.828.,Answer the following question:
What is the movie Goyo about?,"The film titled 'Goyo' was released on June 27, 2024. It falls under the genres of Drama, Romance, Comedy. The film was directed by Marcos Carnevale and stars Nicolas Furtado, Nancy Duplaa, Soledad Villamil, Pablo Rago, Cecilia Roth, Diego Alonso, Milo Zeus Lis, Balthazar Murillo, Javier Linares, Graciana Urbani. The lead actor is Nicolas Furtado. Plot summary: A young autistic museum guide lives by a strict routine -- until he falls in love with his coworker and must confront a whirlwind of new, intense emotions.. It has received a rating of 6.828.",Answer the following question:
What is the plot of Twisters?,"The plot of 'Twisters' is about As storm season intensifies, the paths of former storm chaser Kate Carter and reckless social-media superstar Tyler Owens collide when terrifying phenomena never seen before are unleashed. The pair and their competing teams find themselves squarely in the paths of multiple storm systems converging over central Oklahoma in the fight of their lives..",Answer the following question:
Who are in the cast of Twisters?,"The cast of 'Twisters' includes Daisy Edgar-Jones, Glen Powell, Anthony Ramos, Brandon Perea, Maura Tierney, Harry Hadden-Paton, Sasha Lane, Daryl McCormack, Kiernan Shipka, Nik Dodani.",Answer the following question:
Who directed Twisters?,'Twisters' was directed by Lee Isaac Chung.,Answer the following question:
What are the genres of Twisters?,"The genres of 'Twisters' are Action, Adventure, Thriller.",Answer the following question:
Who is the lead actor in Twisters?,The lead actor in 'Twisters' is Daisy Edgar-Jones.,Answer the following question:
When was Twisters released?,"'Twisters' was released on July 10, 2024.",Answer the following question:
Who are the supporting actors in Twisters?,"The supporting actors in 'Twisters' are Glen Powell, Anthony Ramos, Brandon Perea, Maura Tierney, Harry Hadden-Paton, Sasha Lane, Daryl McCormack, Kiernan Shipka, Nik Dodani.",Answer the following question:
What is the rating of Twisters?,The rating of 'Twisters' is 7.4.,Answer the following question:
What is the movie Twisters about?,"The film titled 'Twisters' was released on July 10, 2024. It falls under the genres of Action, Adventure, Thriller. The film was directed by Lee Isaac Chung and stars Daisy Edgar-Jones, Glen Powell, Anthony Ramos, Brandon Perea, Maura Tierney, Harry Hadden-Paton, Sasha Lane, Daryl McCormack, Kiernan Shipka, Nik Dodani. The lead actor is Daisy Edgar-Jones. Plot summary: As storm season intensifies, the paths of former storm chaser Kate Carter and reckless social-media superstar Tyler Owens collide when terrifying phenomena never seen before are unleashed. The pair and their competing teams find themselves squarely in the paths of multiple storm systems converging over central Oklahoma in the fight of their lives.. It has received a rating of 7.4.",Answer the following question:
What is the plot of Civil War?,"The plot of 'Civil War' is about In the near future, a group of war journalists attempt to survive while reporting the truth as the United States stands on the brink of civil war..",Answer the following question:
Who are in the cast of Civil War?,"The cast of 'Civil War' includes Kirsten Dunst, Wagner Moura, Cailee Spaeny, Stephen McKinley Henderson, Nelson Lee, Nick Offerman, Jefferson White, Evan Lai, Vince Pisani, Justin James Boykin.",Answer the following question:
Who directed Civil War?,'Civil War' was directed by Alex Garland.,Answer the following question:
What are the genres of Civil War?,"The genres of 'Civil War' are War, Action, Drama.",Answer the following question:
Who is the lead actor in Civil War?,The lead actor in 'Civil War' is Kirsten Dunst.,Answer the following question:
When was Civil War released?,"'Civil War' was released on April 10, 2024.",Answer the following question:
Who are the supporting actors in Civil War?,"The supporting actors in 'Civil War' are Wagner Moura, Cailee Spaeny, Stephen McKinley Henderson, Nelson Lee, Nick Offerman, Jefferson White, Evan Lai, Vince Pisani, Justin James Boykin.",Answer the following question:
What is the rating of Civil War?,The rating of 'Civil War' is 6.986.,Answer the following question:
What is the movie Civil War about?,"The film titled 'Civil War' was released on April 10, 2024. It falls under the genres of War, Action, Drama. The film was directed by Alex Garland and stars Kirsten Dunst, Wagner Moura, Cailee Spaeny, Stephen McKinley Henderson, Nelson Lee, Nick Offerman, Jefferson White, Evan Lai, Vince Pisani, Justin James Boykin. The lead actor is Kirsten Dunst. Plot summary: In the near future, a group of war journalists attempt to survive while reporting the truth as the United States stands on the brink of civil war.. It has received a rating of 6.986.",Answer the following question:
What is the plot of Under Paris?,"The plot of 'Under Paris' is about In order to save Paris from an international bloodbath, a grieving scientist is forced to face her tragic past when a giant shark appears in the Seine..",Answer the following question:
Who are in the cast of Under Paris?,"The cast of 'Under Paris' includes Berenice Bejo, Nassim Lyes, Lea Leviant, Nagisa Morimoto, Anais Parello, Inaki Lartigue, Anne Marivin, Timi-Joy Marbot, Ricky Tribord, Aurelia Petit.",Answer the following question:
Who directed Under Paris?,'Under Paris' was directed by Xavier Gens.,Answer the following question:
What are the genres of Under Paris?,"The genres of 'Under Paris' are Thriller, Horror, Action, Mystery.",Answer the following question:
Who is the lead actor in Under Paris?,The lead actor in 'Under Paris' is Berenice Bejo.,Answer the following question:
When was Under Paris released?,"'Under Paris' was released on June 04, 2024.",Answer the following question:
Who are the supporting actors in Under Paris?,"The supporting actors in 'Under Paris' are Nassim Lyes, Lea Leviant, Nagisa Morimoto, Anais Parello, Inaki Lartigue, Anne Marivin, Timi-Joy Marbot, Ricky Tribord, Aurelia Petit.",Answer the following question:
What is the rating of Under Paris?,The rating of 'Under Paris' is 6.094.,Answer the following question:
What is the movie Under Paris about?,"The film titled 'Under Paris' was released on June 04, 2024. It falls under the genres of Thriller, Horror, Action, Mystery. The film was directed by Xavier Gens and stars Berenice Bejo, Nassim Lyes, Lea Leviant, Nagisa Morimoto, Anais Parello, Inaki Lartigue, Anne Marivin, Timi-Joy Marbot, Ricky Tribord, Aurelia Petit. The lead actor is Berenice Bejo. Plot summary: In order to save Paris from an international bloodbath, a grieving scientist is forced to face her tragic past when a giant shark appears in the Seine.. It has received a rating of 6.094.",Answer the following question:
What is the plot of Black Noise?,"The plot of 'Black Noise' is about Members of an elite security team deployed to rescue a VIP on an exclusive island.The rescue mission becomes a desperate attempt to survive, escape the island and elude the sinister presence that seeks to harm them..",Answer the following question:
Who are in the cast of Black Noise?,"The cast of 'Black Noise' includes Jackson Rathbone, Alex Pettyfer, Eve Mauro, Ashton Leigh, Wayne Gordon, Sadie Newman, Thomas Downey, Niki Spiridakos, Gene Freeman, Frank Corbie.",Answer the following question:
Who directed Black Noise?,'Black Noise' was directed by Philippe Martinez.,Answer the following question:
What are the genres of Black Noise?,"The genres of 'Black Noise' are Action, Science Fiction, Horror, Thriller.",Answer the following question:
Who is the lead actor in Black Noise?,The lead actor in 'Black Noise' is Jackson Rathbone.,Answer the following question:
When was Black Noise released?,"'Black Noise' was released on November 03, 2023.",Answer the following question:
Who are the supporting actors in Black Noise?,"The supporting actors in 'Black Noise' are Alex Pettyfer, Eve Mauro, Ashton Leigh, Wayne Gordon, Sadie Newman, Thomas Downey, Niki Spiridakos, Gene Freeman, Frank Corbie.",Answer the following question:
What is the rating of Black Noise?,The rating of 'Black Noise' is 5.278.,Answer the following question:
What is the movie Black Noise about?,"The film titled 'Black Noise' was released on November 03, 2023. It falls under the genres of Action, Science Fiction, Horror, Thriller. The film was directed by Philippe Martinez and stars Jackson Rathbone, Alex Pettyfer, Eve Mauro, Ashton Leigh, Wayne Gordon, Sadie Newman, Thomas Downey, Niki Spiridakos, Gene Freeman, Frank Corbie. The lead actor is Jackson Rathbone. Plot summary: Members of an elite security team deployed to rescue a VIP on an exclusive island.The rescue mission becomes a desperate attempt to survive, escape the island and elude the sinister presence that seeks to harm them.. It has received a rating of 5.278.",Answer the following question:
What is the plot of Boneyard?,"The plot of 'Boneyard' is about After Police Chief Carter discovers the remains of eleven women, FBI Special Agent Petrovick is recruited to profile the serial killer responsible for the infamous ""boneyard"" killings. As the police force, narcotics agency, and FBI lock horns, a tangled web of intrigue turns everyone into a suspect..",Answer the following question:
Who are in the cast of Boneyard?,"The cast of 'Boneyard' includes Mel Gibson, Nora Zehetner, Gabrielle Haugh, 50 Cent, Brian Van Holt, Spice Williams-Crosby, Weston Cage, Michael Sirow, Sean Patrick Bryan, Brenna Marie Narayan.",Answer the following question:
Who directed Boneyard?,'Boneyard' was directed by Asif Akbar.,Answer the following question:
What are the genres of Boneyard?,"The genres of 'Boneyard' are Action, Thriller.",Answer the following question:
Who is the lead actor in Boneyard?,The lead actor in 'Boneyard' is Mel Gibson.,Answer the following question:
When was Boneyard released?,"'Boneyard' was released on July 05, 2024.",Answer the following question:
Who are the supporting actors in Boneyard?,"The supporting actors in 'Boneyard' are Nora Zehetner, Gabrielle Haugh, 50 Cent, Brian Van Holt, Spice Williams-Crosby, Weston Cage, Michael Sirow, Sean Patrick Bryan, Brenna Marie Narayan.",Answer the following question:
What is the rating of Boneyard?,The rating of 'Boneyard' is 5.919.,Answer the following question:
What is the movie Boneyard about?,"The film titled 'Boneyard' was released on July 05, 2024. It falls under the genres of Action, Thriller. The film was directed by Asif Akbar and stars Mel Gibson, Nora Zehetner, Gabrielle Haugh, 50 Cent, Brian Van Holt, Spice Williams-Crosby, Weston Cage, Michael Sirow, Sean Patrick Bryan, Brenna Marie Narayan. The lead actor is Mel Gibson. Plot summary: After Police Chief Carter discovers the remains of eleven women, FBI Special Agent Petrovick is recruited to profile the serial killer responsible for the infamous ""boneyard"" killings. As the police force, narcotics agency, and FBI lock horns, a tangled web of intrigue turns everyone into a suspect.. It has received a rating of 5.919.",Answer the following question:
What is the plot of The Jack in the Box: Rises?,"The plot of 'The Jack in the Box: Rises' is about When a creepy Jack-in-the-Box is discovered and opened on the grounds of an exclusive girls' school, six brave students soon enter a fight to the finish against the unleashed demon..",Answer the following question:
Who are in the cast of The Jack in the Box: Rises?,"The cast of 'The Jack in the Box: Rises' includes Nicholas Anscombe, Isabella Colby Browne, Derek Nelson, Georgia Conlan, James Reynard, Leona Clarke, Georgina Jane, Oli Meredith.",Answer the following question:
Who directed The Jack in the Box: Rises?,'The Jack in the Box: Rises' was directed by Lawrence Fowler.,Answer the following question:
What are the genres of The Jack in the Box: Rises?,The genres of 'The Jack in the Box: Rises' are Horror.,Answer the following question:
Who is the lead actor in The Jack in the Box: Rises?,The lead actor in 'The Jack in the Box: Rises' is Nicholas Anscombe.,Answer the following question:
When was The Jack in the Box: Rises released?,"'The Jack in the Box: Rises' was released on January 18, 2024.",Answer the following question:
Who are the supporting actors in The Jack in the Box: Rises?,"The supporting actors in 'The Jack in the Box: Rises' are Isabella Colby Browne, Derek Nelson, Georgia Conlan, James Reynard, Leona Clarke, Georgina Jane, Oli Meredith.",Answer the following question:
What is the rating of The Jack in the Box: Rises?,The rating of 'The Jack in the Box: Rises' is 6.967.,Answer the following question:
What is the movie The Jack in the Box: Rises about?,"The film titled 'The Jack in the Box: Rises' was released on January 18, 2024. It falls under the genres of Horror. The film was directed by Lawrence Fowler and stars Nicholas Anscombe, Isabella Colby Browne, Derek Nelson, Georgia Conlan, James Reynard, Leona Clarke, Georgina Jane, Oli Meredith. The lead actor is Nicholas Anscombe. Plot summary: When a creepy Jack-in-the-Box is discovered and opened on the grounds of an exclusive girls' school, six brave students soon enter a fight to the finish against the unleashed demon.. It has received a rating of 6.967.",Answer the following question:
What is the plot of A Quiet Place: Day One?,"The plot of 'A Quiet Place: Day One' is about As New York City is invaded by alien creatures who hunt by sound, a woman named Sam fights to survive with her cat..",Answer the following question:
Who are in the cast of A Quiet Place: Day One?,"The cast of 'A Quiet Place: Day One' includes Lupita Nyong'o, Joseph Quinn, Alex Wolff, Djimon Hounsou, Eliane Umuhire, Takunda Khumalo, Alfie Todd, Avy-Berry Worrall, Ronnie Le Drew, Benjamin Wong.",Answer the following question:
Who directed A Quiet Place: Day One?,'A Quiet Place: Day One' was directed by Michael Sarnoski.,Answer the following question:
What are the genres of A Quiet Place: Day One?,"The genres of 'A Quiet Place: Day One' are Horror, Science Fiction, Thriller.",Answer the following question:
Who is the lead actor in A Quiet Place: Day One?,The lead actor in 'A Quiet Place: Day One' is Lupita Nyong'o.,Answer the following question:
When was A Quiet Place: Day One released?,"'A Quiet Place: Day One' was released on June 26, 2024.",Answer the following question:
Who are the supporting actors in A Quiet Place: Day One?,"The supporting actors in 'A Quiet Place: Day One' are Joseph Quinn, Alex Wolff, Djimon Hounsou, Eliane Umuhire, Takunda Khumalo, Alfie Todd, Avy-Berry Worrall, Ronnie Le Drew, Benjamin Wong.",Answer the following question:
What is the rating of A Quiet Place: Day One?,The rating of 'A Quiet Place: Day One' is 6.9.,Answer the following question:
What is the movie A Quiet Place: Day One about?,"The film titled 'A Quiet Place: Day One' was released on June 26, 2024. It falls under the genres of Horror, Science Fiction, Thriller. The film was directed by Michael Sarnoski and stars Lupita Nyong'o, Joseph Quinn, Alex Wolff, Djimon Hounsou, Eliane Umuhire, Takunda Khumalo, Alfie Todd, Avy-Berry Worrall, Ronnie Le Drew, Benjamin Wong. The lead actor is Lupita Nyong'o. Plot summary: As New York City is invaded by alien creatures who hunt by sound, a woman named Sam fights to survive with her cat.. It has received a rating of 6.9.",Answer the following question:
What is the plot of Inside Out?,"The plot of 'Inside Out' is about When 11-year-old Riley moves to a new city, her Emotions team up to help her through the transition. Joy, Fear, Anger, Disgust and Sadness work together, but when Joy and Sadness get lost, they must journey through unfamiliar places to get back home..",Answer the following question:
Who are in the cast of Inside Out?,"The cast of 'Inside Out' includes Amy Poehler, Phyllis Smith, Richard Kind, Bill Hader, Lewis Black, Mindy Kaling, Kaitlyn Dias, Diane Lane, Kyle MacLachlan, Paula Poundstone.",Answer the following question:
Who directed Inside Out?,'Inside Out' was directed by Pete Docter.,Answer the following question:
What are the genres of Inside Out?,"The genres of 'Inside Out' are Animation, Family, Adventure, Drama, Comedy.",Answer the following question:
Who is the lead actor in Inside Out?,The lead actor in 'Inside Out' is Amy Poehler.,Answer the following question:
When was Inside Out released?,"'Inside Out' was released on June 17, 2015.",Answer the following question:
Who are the supporting actors in Inside Out?,"The supporting actors in 'Inside Out' are Phyllis Smith, Richard Kind, Bill Hader, Lewis Black, Mindy Kaling, Kaitlyn Dias, Diane Lane, Kyle MacLachlan, Paula Poundstone.",Answer the following question:
What is the rating of Inside Out?,The rating of 'Inside Out' is 7.916.,Answer the following question:
What is the movie Inside Out about?,"The film titled 'Inside Out' was released on June 17, 2015. It falls under the genres of Animation, Family, Adventure, Drama, Comedy. The film was directed by Pete Docter and stars Amy Poehler, Phyllis Smith, Richard Kind, Bill Hader, Lewis Black, Mindy Kaling, Kaitlyn Dias, Diane Lane, Kyle MacLachlan, Paula Poundstone. The lead actor is Amy Poehler. Plot summary: When 11-year-old Riley moves to a new city, her Emotions team up to help her through the transition. Joy, Fear, Anger, Disgust and Sadness work together, but when Joy and Sadness get lost, they must journey through unfamiliar places to get back home.. It has received a rating of 7.916.",Answer the following question:
What is the plot of Trigger Warning?,The plot of 'Trigger Warning' is about A Special Forces commando uncovers a dangerous conspiracy when she returns to her hometown looking for answers into her beloved father's death..,Answer the following question:
Who are in the cast of Trigger Warning?,"The cast of 'Trigger Warning' includes Jessica Alba, Anthony Michael Hall, Tone Bell, Mark Webber, Jake Weary, Gabriel Basso, Kaiwi Lyman, Hari Dhillon, Alejandro De Hoyos, Nadiv Molcho.",Answer the following question:
